Paper Title,Authors,Description,Tags/Comments,Conference Venue,Year,Paper link,Additional resources
The Fallacy of AI Functionality,"Inioluwa Deborah Raji, I. Elizabeth Kumar, Aaron Horowitz, Andrew D. Selbst","Deployed AI systems often do not work. They can be constructed haphazardly, deployed indiscriminately, and promoted deceptively. However, despite this reality, scholars, the press, and policymakers pay too little attention to functionality. This leads to technical and policy solutions focused on “ethical” or value-aligned deployments, often skipping over the prior question of whether a given system functions, or provides any benefits at all. To describe the harms of various types of functionality failures, we analyze a set of case studies to create a taxonomy of known AI functionality issues. We then point to policy and organizational responses that are often overlooked and become more readily available once functionality is drawn into focus. We argue that functionality is a meaningful AI policy challenge, operating as a necessary first step towards protecting affected communities from algorithmic harm.","Viability Assessments-General, Problem Identification",FAccT,2022,https://dl.acm.org/doi/10.1145/3531146.3533158,
"When not to design, build, or deploy","Solon Barocas, Biega, Asia J., Biega, Benjamin Fish, Jundefineddrzej Niklas, Luke Stark","Recent debate within the FAT* community has focused on how the field conceptualizes the problems it seeks to address, what approach the field should take in attempting to address these problems, and whether the field should even pursue some of the proposed remedies. Questions regarding when not to design, build, or deploy a technology are perhaps the most common expression of this trend. Identifying the problems to address is inextricably linked to the broader question of how to collectively make decisions about what technologies our societies need and want.","Viability Assessments-General, Problem Identification",FAccT,2020,https://dl.acm.org/doi/abs/10.1145/3351095.3375691,
Against Predictive Optimization: On the Legitimacy of Decision-Making Algorithms that Optimize Predictive Accuracy,"Angelina Wang, Sayash Kapoor, Solon Barocas, Arvind Narayanan","We formalize predictive optimization, a category of decision-making algorithms that use machine learning (ML) to predict future outcomes of interest about individuals. For example, pre-trial risk prediction algorithms such as COMPAS use ML to predict whether an individual will re-offend in the future. Our thesis is that predictive optimization raises a distinctive and serious set of normative concerns that render it presumptively illegitimate. To test this, we review 387 reports, articles, and web pages from academia, industry, non-profits, governments, and modeling contests, and find many real-world examples of predictive optimization. We select eight particularly consequential examples as case studies. Simultaneously, we develop a set of normative and technical critiques that challenge the claims made by the developers of these applications—in particular, claims of increased accuracy, efficiency, and fairness. Our key finding is that these critiques apply to each of the applications, are not easily evaded by redesigning the systems, and thus challenge the legitimacy of their deployment. We argue that the burden of evidence for justifying why the deployment of predictive optimization is not harmful should rest with the developers of the tools. Based on our analysis, we provide a rubric of critical questions that can be used to deliberate or contest the legitimacy of specific predictive optimization applications.","Viability Assessments-General, Measurement",SSRN,2022,https://papers.ssrn.com/sol3/papers.cfm?abstract_id=4238015,
A validity perspective on evaluating the justified use of data-driven decision-making algorithms,"Ama Coston, Anna Kawakami, Haiyi Zhu, Ken Holstein, Hoda Heidari","Recent research increasingly brings to question the appropriateness of using predictive tools in complex, real-world tasks. While a growing body of work has explored ways to improve value alignment in these tools, comparatively less work has centered concerns around the fundamental justifiability of using these tools. This work seeks to center validity considerations in deliberations around whether and how to build data-driven algorithms in high-stakes domains. Toward this end, we translate key concepts from validity theory to predictive algorithms. We apply the lens of validity to re-examine common challenges in problem formulation and data issues that jeopardize the justifiability of using predictive algorithms and connect these challenges to the social science discourse around validity. Our interdisciplinary exposition clarifies how these concepts apply to algorithmic decision making contexts. We demonstrate how these validity considerations could distill into a series of high-level questions intended to promote and document reflections on the legitimacy of the predictive task and the suitability of the data.","Viability Assessments-General, Measurement",SATML,2023,https://arxiv.org/abs/2206.14983,
Algorithmic fairness and vertical equity: Income fairness with irs tax audit models,"Emily Black, Hadi Elzayn, Alexra Chouldechova, Jacob Goldin, Daniel Ho","This study examines issues of algorithmic fairness in the context of systems that inform tax audit selection by the United States Internal Revenue Service (IRS). While the field of algorithmic fairness has developed primarily around notions of treating like individuals alike, we instead explore the concept of vertical equity‚Äîappropriately accounting for relevant differences across individuals‚Äîwhich is a central component of fairness in many public policy settings. Applied to the design of the U.S. individual income tax system, vertical equity relates to the fair allocation of tax and enforcement burdens across taxpayers of different income levels. Through a unique collaboration with the Treasury Department and IRS, we use access to detailed, anonymized individual taxpayer microdata, risk-selected audits, and random audits from 2010-14 to study vertical equity in tax administration. In particular, we assess how the adoption of modern machine learning methods for selecting taxpayer audits may affect vertical equity. Our paper makes four contributions. First, we show how the adoption of more flexible machine learning (classification) methods‚Äîas opposed to simpler models‚Äîshapes vertical equity by shifting audit burdens from high to middle-income taxpayers. Second, given concerns about high audit rates of low-income taxpayers, we investigate how existing algorithmic fairness techniques would change the audit distribution. We find that such methods can mitigate some disparities across income buckets, but that these come at a steep cost to performance. Third, we show that the choice of whether to treat risk of underreporting as a classification or regression problem is highly consequential. Moving from a classification approach to a regression approach to predict the expected magnitude of underreporting shifts the audit burden substantially toward high income individuals, while increasing revenue. Last, we investigate the role of differential audit cost in shaping the distribution of audits. Audits of lower income taxpayers, for instance, are typically conducted by mail and hence pose much lower cost to the IRS. We show that a narrow focus on return-on-investment can undermine vertical equity. Our results have implications for ongoing policy debates and the design of algorithmic tools across the public sector.","Problem Formulation-Prediction Target, Problem Identification (Case Study)",FAccT,2022,https://dl.acm.org/doi/10.1145/3531146.3533204,
Dissecting racial bias in an algorithm used to manage the health of populations,"Ziad Obermeyer, Brian Powers, Christine Vogeli, Sendhil Mullainathan","Health systems rely on commercial prediction algorithms to identify and help patients with complex health needs. We show that a widely used algorithm, typical of this industry-wide approach and affecting millions of patients, exhibits significant racial bias: At a given risk score, Black patients are considerably sicker than White patients, as evidenced by signs of uncontrolled illnesses. Remedying this disparity would increase the percentage of Black patients receiving additional help from 17.7 to 46.5%. The bias arises because the algorithm predicts health care costs rather than illness, but unequal access to care means that we spend less money caring for Black patients than for White patients. Thus, despite health care cost appearing to be an effective proxy for health by some measures of predictive accuracy, large racial biases arise. We suggest that the choice of convenient, seemingly effective proxies for ground truth can be an important source of algorithmic bias in many contexts.","Problem Formulation-Prediction Target, Problem Identification (Case Study)",Science,2019,https://www.science.org/doi/abs/10.1126/science.aax2342,
Data augmentation for fairness-aware machine learning: Preventing algorithmic bias in law enforcement systems,"Ioannis Pastaltzidis, Nikolaos Dimitriou, Katherine Quezada-Tavarez, Stergios Aidinlis, Thomas Marquenie, Agata Gurzawska, Dimitrios Tzovaras","Researchers and practitioners in the fairness community have highlighted the ethical and legal challenges of using biased datasets in data-driven systems, with algorithmic bias being a major concern. Despite the rapidly growing body of literature on fairness in algorithmic decision-making, there remains a paucity of fairness scholarship on machine learning algorithms for the real-time detection of crime. This contribution presents an approach for fairness-aware machine learning to mitigate the algorithmic bias / discrimination issues posed by the reliance on biased data when building law enforcement technology. Our analysis is based on RWF-2000, which has served as the basis for violent activity recognition tasks in data-driven law enforcement projects. We reveal issues of overrepresentation of minority subjects in violence situations that limit the external validity of the dataset for real-time crime detection systems and propose data augmentation techniques to rebalance the dataset. The experiments on real world data show the potential to create more balanced datasets by synthetically generated samples, thus mitigating bias and discrimination concerns in law enforcement applications.","Problem Formulation-Prediction Target, Problem Identification (Case Study)",FAccT,2022,https://dl.acm.org/doi/10.1145/3531146.3534644,
"The distributive effects of risk prediction in environmental compliance: Algorithmic design, environmental justice, and public policy","Elinor Benami, Reid Whitaker, Vincent La, Hongjin Lin, Bron R Anderson, Daniel E Ho","Government agencies are embracing machine learning to support a variety of resource allocation decisions. The U.S. Environmental Protection Agency (EPA), for example, has engaged academic research labs to test the use of machine learning in support of an important national initiative to reduce Clean Water Act violations. We evaluate prototypical risk prediction models that can support compliance interventions and demonstrate how critical algorithmic design choices can generate or mitigate disparate impact in environmental enforcement. First, we show that the definition of which facilities to focus on through this national compliance initiative hinges on arbitrary differences in state-level permitting schemes, causing a shift in environmental protection away from areas with more minority populations. Second, the policy objective to reduce the noncompliance rate is encoded in a classification model, which does not account for the extent of pollution beyond the permitted limit. We hence compare allocation schemes between regression and classification, and show that the latter directs attention towards facilities in more rural and white areas. Overall, our study illustrates that as machine learning enters government, algorithmic design can both embed and elucidate sources of administrative policy discretion with discernable distributional consequences.","Problem Formulation-Prediction Target, Mitigation",FAccT,2021,https://dl.acm.org/doi/10.1145/3442188.3445873,
Beyond distributive fairness in algorithmic decision making: Feature selection for procedurally fair learning,"Nina Grgić-Hlača, Muhammad Bilal Zafar, Krishna P Gummadi, Adrian Weller","With widespread use of machine learning methods in numerous domains involving humans, several studies have raised questions about the potential for unfairness towards certain individuals or groups. A number of recent works have proposed methods to measure and eliminate unfairness from machine learning models. However, most of this work has focused on only one dimension of fair decision making: distributive fairness, i.e., the fairness of the decision outcomes. In this work, we leverage the rich literature on organizational justice and focus on another dimension of fair decision making: procedural fairness, i.e., the fairness of the decision making process. We propose measures for procedural fairness that consider the input features used in the decision process, and evaluate the moral judgments of humans regarding the use of these features. We operationalize these measures on two real world datasets using human surveys on the Amazon Mechanical Turk (AMT) platform, demonstrating that our measures capture important properties of procedurally fair decision making. We provide fast submodular mechanisms to optimize the tradeoff between procedural fairness and prediction accuracy. On our datasets, we observe empirically that procedural fairness may be achieved with little cost to outcome fairness, but that some loss of accuracy is unavoidable.","Problem Formulation-Predictive Attributes, Problem Identification",AAAI,2018,https://ojs.aaai.org/index.php/AAAI/article/view/11296,
"Modeling assumptions clash with the real world: Transparency, equity, and community challenges for student assignment algorithms.","Samantha Robertson, Tonya Nguyen, Niloufar Salehi.","Across the United States, a growing number of school districts are turning to matching algorithms to assign students to public schools. The designers of these algorithms aimed to promote values such as transparency, equity, and community in the process. However, school districts have encountered practical challenges in their deployment. In fact, San Francisco Unified School District voted to stop using and completely redesign their student assignment algorithm because it was frustrating for families and it was not promoting educational equity in practice. We analyze this system using a Value Sensitive Design approach and find that one reason values are not met in practice is that the system relies on modeling assumptions about families’ priorities, constraints, and goals that clash with the real world. These assumptions overlook the complex barriers to ideal participation that many families face, particularly because of socioeconomic inequalities. We argue that direct, ongoing engagement with stakeholders is central to aligning algorithmic values with real world conditions. In doing so we must broaden how we evaluate algorithms while recognizing the limitations of purely algorithmic solutions in addressing complex socio-political problems.","Problem Formulation-General, Problem Identification (Case study)",CHI,2021,https://dl.acm.org/doi/10.1145/3411764.3445748,
Algorithmic management reimagined for workers and by workers: Centering worker well-being in gig work,"Angie Zhang, Alexer Boltz, Chun Wei Wang, Min Kyung Lee","Prior research has studied the detrimental impact of algorithmic management on gig workers and strategies that workers devise in response. However, little work has investigated alternative platform designs to promote worker well-being, particularly from workers’ own perspectives. We use a participatory design approach wherein workers explore their algorithmic imaginaries to co-design interventions that center their lived experiences, preferences, and well-being in algorithmic management. Our interview and participatory design sessions highlight how various design dimensions of algorithmic management, including information asymmetries and unfair, manipulative incentives, hurt worker well-being. Workers generate designs to address these issues while considering competing interests of the platforms, customers, and themselves, such as information translucency, incentives co-configured by workers and platforms, worker-centered data-driven insights for well-being, and collective driver data sharing. Our work offers a case study that responds to a call for designing worker-centered digital work and contributes to emerging literature on algorithmic work.","Problem Formulation-General, Problem Identification (Case study)",CHI,2022,https://dl.acm.org/doi/10.1145/3491102.3501866,
Re-imagining systems in the realm of immigration in higher education through participatory design.,Maria Conchita A. Navarro  Orit Shaer,"Students identifying with communities within the realm of immigration, including immigrants, refugees, international students, and undocumented individuals, often face difficulties navigating life in elite institutions of higher education. HCI scholars who have worked with migrant communities have called for future explorations on the role of participatory approaches in helping bring different stakeholders together to design for better technologies and socio-technical systems supporting their needs. In this paper we present preliminary findings from a participatory design study at an elite liberal-arts college in the U.S., exploring the role of an equity-centered hackathon-style event in bringing together different student communities on campus and collaboratively re-imagining today’s technologies and systems. We discuss possible best practices for designing inclusive and safe hackathon-style events for communities in the realm of immigration.","Problem Formulation-General, Problem Identification (Case study)",CSCW,2022,https://dl.acm.org/doi/10.1145/3500868.3559457,
"""I feel like I need to split myself in half"": Using Role Theory to Design for Parents as Caregiving Teams in the Children's Hospital","Sarah Nikkhah, Akash Uday Rode, Priyanjali Mittal, Neha K. Kulkarni, Salonee Nadkarni, Emily L. Mueller,  Andrew D. Miller","When their child is hospitalized, parents take on new caregiving roles, in addition to their existing home and work-related responsibilities. Previous CSCW research has shown how technologies can support caregiving, but more research is needed to systematically understand how technology could support parents and other family caregivers as they adopt new coordination roles in their collaborations with each other. This paper reports findings from an interview study with parents of children hospitalized for cancer treatment. We used the Role Theory framework from the social sciences to show how parents adopt and enact caregiving roles during hospitalization and the challenges they experience as they adapt to this stressful situation. We show how parents experience 'role strain' as they attempt to divide caregiving work and introduce the concept of 'inter-caregiver information disparity.' We propose design opportunities for caregiving coordination technologies to better support caregiving roles in multi-caregiver teams.","Problem Formulation-General, Problem Identification (Case study)",CSCW,2022,https://dl.acm.org/doi/10.1145/3500868.3559466,
Problem formulation and fairness,"Samir Passi, Solon Barocas","Formulating data science problems is an uncertain and difficult process. It requires various forms of discretionary work to translate high-level objectives or strategic goals into tractable problems, necessitating, among other things, the identification of appropriate target variables and proxies. While these choices are rarely self-evident, normative assessments of data science projects often take them for granted, even though different translations can raise profoundly different ethical concerns. Whether we consider a data science project fair often has as much to do with the formulation of the problem as any property of the resulting model. Building on six months of ethnographic fieldwork with a corporate data science team---and channeling ideas from sociology and history of science, critical data studies, and early writing on knowledge discovery in databases---we describe the complex set of actors and activities involved in problem formulation. Our research demonstrates that the specification and operationalization of the problem are always negotiated and elastic, and rarely worked out with explicit normative considerations in mind. In so doing, we show that careful accounts of everyday data science work can help us better understand how and why data science problems are posed in certain ways---and why specific formulations prevail in practice, even in the face of what might seem like normatively preferable alternatives. We conclude by discussing the implications of our findings, arguing that effective normative interventions will require attending to the practical work of problem formulation.","Problem Formulation-General, Problem Identification",FAccT,2019,https://dl.acm.org/doi/10.1145/3287560.3287567,
A case study of algorithm-assisted decision making in child maltreatment hotline screening decisions,"Alexra Chouldechova, Diana Benavides-Prado, Oleksr Fialko,  Rhema Vaithianathan","Every year there are more than 3.6 million referrals made to child protection agencies across the US. The practice of screening calls is left to each jurisdiction to follow local practices and policies, potentially leading to large variation in the way in which referrals are treated across the country. Whilst increasing access to linked administrative data is available, it is difficult for welfare workers to make systematic use of historical information about all the children and adults on a single referral call. Risk prediction models that use routinely collected administrative data can help call workers to better identify cases that are likely to result in adverse outcomes. However, the use of predictive analytics in the area of child welfare is contentious. There is a possibility that some communities—such as those in poverty or from particular racial and ethnic groups—will be disadvantaged by the reliance on government administrative data. On the other hand, these analytics tools can augment or replace human judgments, which themselves are biased and imperfect. In this paper we describe our work on developing, validating, fairness auditing, and deploying a risk prediction model in Allegheny County, Pennsylvania, USA. We discuss the results of our analysis to-date, and also highlight key problems and data bias issues that present challenges for model evaluation and deployment.","Problem Formulation-General, Problem Identification (Case study)",FAccT,2018,https://proceedings.mlr.press/v81/chouldechova18a.html,
Measurement and Fairness,Abigail Z. Jacobs  Hanna Wallach,"We propose measurement modeling from the quantitative social sciences as a framework for understanding fairness in computational systems. Computational systems often involve unobservable theoretical constructs, such as socioeconomic status, teacher effectiveness, and risk of recidivism. Such constructs cannot be measured directly and must instead be inferred from measurements of observable properties (and other unobservable theoretical constructs) thought to be related to them---i.e., operationalized via a measurement model. This process, which necessarily involves making assumptions, introduces the potential for mismatches between the theoretical understanding of the construct purported to be measured and its operationalization. We argue that many of the harms discussed in the literature on fairness in computational systems are direct results of such mismatches. We show how some of these harms could have been anticipated and, in some cases, mitigated if viewed through the lens of measurement modeling. To do this, we contribute fairness-oriented conceptualizations of construct reliability and construct validity that unite traditions from political science, education, and psychology and provide a set of tools for making explicit and testing assumptions about constructs and their operationalizations. We then turn to fairness itself, an essentially contested construct that has different theoretical understandings in different contexts. We argue that this contestedness underlies recent debates about fairness definitions: although these debates appear to be about different operationalizations, they are, in fact, debates about different theoretical understandings of fairness. We show how measurement modeling can provide a framework for getting to the core of these debates.","Problem Formulation-General, Problem Identification",FAccT,2021,https://dl.acm.org/doi/10.1145/3442188.3445901,
