Paper Title,Authors,Description,Tags/Comments,Conference Venue,Year,Paper link,Additional resources
Too Relaxed to Be Fair,"Michael Lohaus, Michael Perrot,  Ulrike Von Luxburg","We address the problem of classification under fairness constraints. Given a notion of fairness, the goal is to learn a classifier that is not discriminatory against a group of individuals. In the literature, this problem is often formulated as a constrained optimization problem and solved using relaxations of the fairness constraints. We show that many existing relaxations are unsatisfactory: even if a model satisfies the relaxed constraint, it can be surprisingly unfair. We propose a principled framework to solve this problem. This new approach uses a strongly convex formulation and comes with theoretical guarantees on the fairness of its solution. In practice, we show that this method gives promising results on real data.","Statistical Modeling-General, Problem Identification",ICML,2020,https://proceedings.mlr.press/v119/lohaus20a.html,
Characterizing Fairness Over the Set of Good Models Under Selective Labels,"Ama Coston, Ashesh Rambachan,  Alexra Chouldechova","Algorithmic risk assessments are used to inform decisions in a wide variety of high-stakes settings. Often multiple predictive models deliver similar overall performance but differ markedly in their predictions for individual cases, an empirical phenomenon known as the ‚ÄúRashomon Effect.‚Äù These models may have different properties over various groups, and therefore have different predictive fairness properties. We develop a framework for characterizing predictive fairness properties over the set of models that deliver similar overall performance, or ‚Äúthe set of good models.‚Äù Our framework addresses the empirically relevant challenge of selectively labelled data in the setting where the selection decision and outcome are unconfounded given the observed data features. Our framework can be used to 1) audit for predictive bias; or 2) replace an existing model with one that has better fairness properties. We illustrate these use cases on a recidivism prediction task and a real-world credit-scoring task.","Statistical Modeling-General, Problem Identification",ICML,2021,https://proceedings.mlr.press/v139/coston21a.html,
"Putting Fairness Principles into Practice: Challenges, Metrics, and Improvements","Alex Beutel, Jilin Chen, Tulsee Doshi, Hai Qian, Allison Woodruff, Christine Luu, Pierre Kreitmann, Jonathan Bischof,  Ed H. Ch","As more researchers have become aware of and passionate about algorithmic fairness, there has been an explosion in papers laying out new metrics, suggesting algorithms to address issues, and calling attention to issues in existing applications of machine learning. This research has greatly expanded our understanding of the concerns and challenges in deploying machine learning, but there has been much less work in seeing how the rubber meets the road. In this paper we provide a case-study on the application of fairness in machine learning research to a production classification system, and offer new insights in how to measure and address algorithmic fairness issues. We discuss open questions in implementing equality of opportunity and describe our fairness metric, conditional equality, that takes into account distributional differences. Further, we provide a new approach to improve on the fairness metric during model training and demonstrate its efficacy in improving performance for a real-world product.","Statistical Modeling-General, Problem Identification",AIES,2019,https://dl.acm.org/doi/10.1145/3306618.3314234,
A Sandbox Tool to Bias(Stress)-Test Fairness Algorithms,"Nil-Jana Akpinar, Manish Nagireddy, Logan Stapleton, Hao-Fei Cheng, Haiyi Zhu, Steven Wu,  Hoda Heidari","Motivated by the growing importance of reducing unfairness in ML predictions, Fair-ML researchers have presented an extensive suite of algorithmic 'fairness-enhancing' remedies. Most existing algorithms, however, are agnostic to the sources of the observed unfairness. As a result, the literature currently lacks guiding frameworks to specify conditions under which each algorithmic intervention can potentially alleviate the underpinning cause of unfairness. To close this gap, we scrutinize the underlying biases (e.g., in the training data or design choices) that cause observational unfairness. We present the conceptual idea and a first implementation of a bias-injection sandbox tool to investigate fairness consequences of various biases and assess the effectiveness of algorithmic remedies in the presence of specific types of bias. We call this process the bias(stress)-testing of algorithmic interventions. Unlike existing toolkits, ours provides a controlled environment to counterfactually inject biases in the ML pipeline. This stylized setup offers the distinct capability of testing fairness interventions beyond observational data and against an unbiased benchmark. In particular, we can test whether a given remedy can alleviate the injected bias by comparing the predictions resulting after the intervention in the biased setting with true labels in the unbiased regime-that is, before any bias injection. We illustrate the utility of our toolkit via a proof-of-concept case study on synthetic data. Our empirical analysis showcases the type of insights that can be obtained through our simulations.","Statistical Modeling-General, Problem Identification",EAAMO,2022,https://arxiv.org/abs/2204.10233,
Differential privacy has disparate impact on model accuracy,"Eugene Bagdasaryan, Omid Poursaeed,  Vitaly Shmatikov","Differential privacy (DP) is a popular mechanism for training machine learning models with bounded leakage about the presence of specific points in the training data. The cost of differential privacy is a reduction in the model's accuracy. We demonstrate that in the neural networks trained using differentially private stochastic gradient descent (DP-SGD), this cost is not borne equally: accuracy of DP models drops much more for the underrepresented classes and subgroups. For example, a gender classification model trained using DP-SGD exhibits much lower accuracy for black faces than for white faces. Critically, this gap is bigger in the DP model than in the non-DP model, i.e., if the original model is unfair, the unfairness becomes worse once DP is applied. We demonstrate this effect for a variety of tasks and models, including sentiment analysis of text and image classification. We then explain why DP training mechanisms such as gradient clipping and noise addition have disproportionate effect on the underrepresented and more complex subgroups, resulting in a disparate reduction of model accuracy.","Statistical Modeling-General, Problem Identification",NeurIPS,2019,https://dl.acm.org/doi/abs/10.5555/3454287.3455674,
"Fair, Robust, and Data-Efficient Machine Learning in Healthcare",Harvineet Singh,"While machine learning systems have shown improvements, often, in carefully curated settings, challenges still exist to their wider deployment, especially for making consequential decisions. The research described here explores three challenges, particularly, emphasizing the interesting issues that arise at their intersection. How do we design machine learning systems to account for the systemic biases of the world, to act reliably under unseen settings, and to handle limited availability of data? Human-facing applications of machine learning such as personalized health commonly encounter these challenges, thus, these are important to address. The research has three components addressing different parts of the above central question. Here, we describe the work done on two components of the above central question and highlight the future work planned as part of the third one. We draw from methods in causal inference, algorithmic fairness, and interactive learning, and apply them to applications in health.","Statistical Modeling-General, Problem Identification (Case Study)",AIES,2022,https://dl.acm.org/doi/10.1145/3514094.3539552,
Learning the Pareto Front with Hypernetworks,"Aviv Navon, Aviv Shamsian, Ethan Fetaya,  Gal Chechik","Multi-objective optimization (MOO) problems are prevalent in machine learning. These problems have a set of optimal solutions, called the Pareto front, where each point on the front represents a different trade-off between possibly conflicting objectives. Recent MOO methods can target a specific desired ray in loss space however, most approaches still face two grave limitations: (i) A separate model has to be trained for each point on the front; and (ii) The exact trade-off must be known before the optimization process. Here, we tackle the problem of learning the entire Pareto front, with the capability of selecting a desired operating point on the front after training. We call this new setup Pareto-Front Learning (PFL).
We describe an approach to PFL implemented using HyperNetworks, which we term Pareto HyperNetworks (PHNs). PHN learns the entire Pareto front simultaneously using a single hypernetwork, which receives as input a desired preference vector and returns a Pareto-optimal model whose loss vector is in the desired ray. The unified model is runtime efficient compared to training multiple models and generalizes to new operating points not used during training. We evaluate our method on a wide set of problems, from multi-task regression and classification to fairness. PHNs learn the entire Pareto front at roughly the same time as learning a single point on the front and at the same time reach a better solution set. PFL opens the door to new applications where models are selected based on preferences that are only available at run time.","Statistical Modeling-General, Measurement",NeurIPS,2021,https://openreview.net/forum?id=NjF772F4ZZR,
Fairness Under Unawareness: Assessing Disparity When Protected Class Is Unobserved,"Jiahao Chen, Nathan Kallus, Xiaojie Mao, Geoffry Svacha,  Madeleine Udell","Assessing the fairness of a decision making system with respect to a protected class, such as gender or race, is challenging when class membership labels are unavailable. Probabilistic models for predicting the protected class based on observable proxies, such as surname and geolocation for race, are sometimes used to impute these missing labels for compliance assessments. Empirically, these methods are observed to exaggerate disparities, but the reason why is unknown. In this paper, we decompose the biases in estimating outcome disparity via threshold-based imputation into multiple interpretable bias sources, allowing us to explain when over- or underestimation occurs. We also propose an alternative weighted estimator that uses soft classification, and show that its bias arises simply from the conditional covariance of the outcome with the true class membership. Finally, we illustrate our results with numerical simulations and a public dataset of mortgage applications, using geolocation as a proxy for race. We confirm that the bias of threshold-based imputation is generally upward, but its magnitude varies strongly with the threshold chosen. Our new weighted estimator tends to have a negative bias that is much simpler to analyze and reason about.","Statistical Modeling-General, Measurement",FAccT,2019,https://dl.acm.org/doi/10.1145/3287560.3287594,
POTs: protective optimization technologies,"Bogdan Kulynych, Rebekah Overdorf, Carmela Troncoso,  Seda Gürses","Algorithmic fairness aims to address the economic, moral, social, and political impact that digital systems have on populations through solutions that can be applied by service providers. Fairness frameworks do so, in part, by mapping these problems to a narrow definition and assuming the service providers can be trusted to deploy countermeasures. Not surprisingly, these decisions limit fairness frameworks' ability to capture a variety of harms caused by systems. We characterize fairness limitations using concepts from requirements engineering and from social sciences. We show that the focus on algorithms' inputs and outputs misses harms that arise from systems interacting with the world; that the focus on bias and discrimination omits broader harms on populations and their environments; and that relying on service providers excludes scenarios where they are not cooperative or intentionally adversarial. We propose Protective Optimization Technologies (POTs). POTs, provide means for affected parties to address the negative impacts of systems in the environment, expanding avenues for political contestation. POTs intervene from outside the system, do not require service providers to cooperate, and can serve to correct, shift, or expose harms that systems impose on populations and their environments. We illustrate the potential and limitations of POTs in two case studies: countering road congestion caused by traffic beating applications, and recalibrating credit scoring for loan applicants.","Statistical Modeling-General, Measurement",FAccT,2020,https://dl.acm.org/doi/10.1145/3351095.3372853,
Directional Bias Amplification,"Angelina Wang, Olga Russakovsky","Mitigating bias in machine learning systems requires refining our understanding of bias propagation pathways: from societal structures to large-scale data to trained models to impact on society. In this work, we focus on one aspect of the problem, namely bias amplification: the tendency of models to amplify the biases present in the data they are trained on. A metric for measuring bias amplification was introduced in the seminal work by Zhao et al. (2017); however, as we demonstrate, this metric suffers from a number of shortcomings including conflating different types of bias amplification and failing to account for varying base rates of protected attributes. We introduce and analyze a new, decoupled metric for measuring bias amplification, $BiasAmp_{\rightarrow}$ (Directional Bias Amplification). We thoroughly analyze and discuss both the technical assumptions and normative implications of this metric. We provide suggestions about its measurement by cautioning against predicting sensitive attributes, encouraging the use of confidence intervals due to fluctuations in the fairness of models across runs, and discussing the limitations of what this metric captures. Throughout this paper, we work to provide an interrogative look at the technical measurement of bias amplification, guided by our normative ideas of what we want it to encompass. Code is located at https://github.com/princetonvisualai/directional-bias-amp.","Statistical Modeling-General, Measurement",ICML,2021,https://proceedings.mlr.press/v139/wang21t.html,
On the Tradeoff Between Robustness and Fairness,"Xinsong Ma, Zekai Wang,  Weiwei Liu","Interestingly, recent experimental results [2, 26, 22] have identified a robust fairness phenomenon in adversarial training (AT), namely that a robust model well-trained by AT exhibits a remarkable disparity of standard accuracy and robust accuracy among different classes compared with natural training. However, the effect of different perturbation radii in AT on robust fairness has not been studied, and one natural question is raised: does a tradeoff exist between average robustness and robust fairness? Our extensive experimental results provide an affirmative answer to this question: with an increasing perturbation radius, stronger AT will lead to a larger class-wise disparity of robust accuracy. Theoretically, we analyze the class-wise performance of adversarially trained linear models with mixture Gaussian distribution. Our theoretical results support our observations. Moreover, our theory shows that  adversarial training easily leads to more serious robust fairness issue than natural training. Motivated by theoretical results, we propose a fairly adversarial training (FAT) method to mitigate the tradeoff between average robustness and robust fairness. Experimental results validate the effectiveness of our proposed method.","Statistical Modeling-General, Measurement",NeurIPS,2022,https://openreview.net/forum?id=LqGA2JMLwBw,
Refining Language Models with Compositional Explanations,"Huihan Yao, Ying Chen, Qinyuan Ye, Xisen Jin,  Xiang Ren","Pre-trained language models have been successful on text classification tasks, but are prone to learning spurious correlations from biased datasets, and are thus vulnerable when making inferences in a new domain. Prior work reveals such spurious patterns via post-hoc explanation algorithms which compute the importance of input features. Further, the model is regularized to align the importance scores with human knowledge, so that the unintended model behaviors are eliminated. However, such a regularization technique lacks flexibility and coverage, since only importance scores towards a pre-defined list of features are adjusted, while more complex human knowledge such as feature interaction and pattern generalization can hardly be incorporated. In this work, we propose to refine a learned language model for a target domain by collecting human-provided compositional explanations regarding observed biases. By parsing these explanations into executable logic rules, the human-specified refinement advice from a small set of explanations can be generalized to more training examples. We additionally introduce a regularization term allowing adjustments for both importance and interaction of features to better rectify model behavior. We demonstrate the effectiveness of the proposed approach on two text classification tasks by showing improved performance in target domain as well as improved model fairness after refinement.","Statistical Modeling-General, Mitigation",NeurIPS,2021,https://openreview.net/forum?id=dkw9OQMn1t,
Noise-tolerant fair classification,"Alex Lamy, Ziyuan Zhong, Aditya K Menon,  Nakul Verma","Fairness-aware learning involves designing algorithms that do not discriminate with respect to some sensitive feature (e.g., race or gender). Existing work on the problem operates under the assumption that the sensitive feature available in one's training sample is perfectly reliable. This assumption may be violated in many real-world cases: for example, respondents to a survey may choose to conceal or obfuscate their group identity out of fear of potential discrimination. This poses the question of whether one can still learn fair classifiers given noisy sensitive features. In this paper, we answer the question in the affirmative: we show that if one measures fairness using the mean-difference score, and sensitive features are subject to noise from the mutually contaminated learning model, then owing to a simple identity we only need to change the desired fairness-tolerance. The requisite tolerance can be estimated by leveraging existing noise-rate estimators from the label noise literature. We finally show that our procedure is empirically effective on two case-studies involving sensitive feature censoring.","Statistical Modeling-General, Mitigation",NeurIPS,2019,https://dl.acm.org/doi/10.5555/3454287.3454314,
Learning certified individually fair representations,"Anian Ruoss, Mislav Balunovic, Marc Fischer,  Martin Vechev","Fair representation learning provides an effective way of enforcing fairness constraints without compromising utility for downstream users. A desirable family of such fairness constraints, each requiring similar treatment for similar individuals, is known as individual fairness. In this work, we introduce the first method that enables data consumers to obtain certificates of individual fairness for existing and new data points. The key idea is to map similar individuals to close latent representations and leverage this latent proximity to certify individual fairness. That is, our method enables the data producer to learn and certify a representation where for a data point all similar individuals are at l-infinity distance at most epsilon, thus allowing data consumers to certify individual fairness by proving epsilon-robustness of their classifier. Our experimental evaluation on five real-world datasets and several fairness constraints demonstrates the expressivity and scalability of our approach.","Statistical Modeling-General, Mitigation",NeurIPS,2020,https://dl.acm.org/doi/10.5555/3495724.3496360,
On Dyadic Fairness: Exploring and Mitigating Bias in Graph Connections,"Peizhao Li, Yifei Wang, Han Zhao, Pengyu Hong,  Hongfu Liu","Disparate impact has raised serious concerns in machine learning applications and its societal impacts. In response to the need of mitigating discrimination, fairness has been regarded as a crucial property in algorithmic design. In this work, we study the problem of disparate impact on graph-structured data. Specifically, we focus on dyadic fairness, which articulates a fairness concept that a predictive relationship between two instances should be independent of the sensitive attributes. Based on this, we theoretically relate the graph connections to dyadic fairness on link predictive scores in learning graph neural networks, and reveal that regulating weights on existing edges in a graph contributes to dyadic fairness conditionally. Subsequently, we propose our algorithm, \textbf{FairAdj}, to empirically learn a fair adjacency matrix with proper graph structural constraints for fair link prediction, and in the meanwhile preserve predictive accuracy as much as possible. Empirical validation demonstrates that our method delivers effective dyadic fairness in terms of various statistics, and at the same time enjoys a favorable fairness-utility tradeoff.","Statistical Modeling-General, Mitigation",ICLR,2021,https://openreview.net/forum?id=xgGS6PmzNq6,
Fair Normalizing Flows,"Mislav Balunovic, Anian Ruoss,  Martin Vechev","Fair representation learning is an attractive approach that promises fairness of downstream predictors by encoding sensitive data. Unfortunately, recent work has shown that strong adversarial predictors can still exhibit unfairness by recovering sensitive attributes from these representations. In this work, we present Fair Normalizing Flows (FNF), a new approach offering more rigorous fairness guarantees for learned representations. Specifically, we consider a practical setting where we can estimate the probability density for sensitive groups. The key idea is to model the encoder as a normalizing flow trained to minimize the statistical distance between the latent representations of different groups. The main advantage of FNF is that its exact likelihood computation allows us to obtain guarantees on the maximum unfairness of any potentially adversarial downstream predictor. We experimentally demonstrate the effectiveness of FNF in enforcing various group fairness notions, as well as other attractive properties such as interpretability and transfer learning, on a variety of challenging real-world datasets.","Statistical Modeling-General, Mitigation",ICLR,2022,https://openreview.net/forum?id=BrFIKuxrZE,
Decoupled Classifiers for Group-Fair and Efficient Machine Learning,"Cynthia Dwork, Nicole Immorlica, Adam Tauman Kalai,  Max Leiserson","When it is ethical and legal to use a sensitive attribute (such as gender or race) in machine learning systems, the question remains how to do so. We show that the naive application of machine learning algorithms using sensitive attributes leads to an inherent tradeoff in accuracy between groups. We provide a simple and efficient decoupling technique, that can be added on top of any black-box machine learning algorithm, to learn different classifiers for different groups. Transfer learning is used to mitigate the problem of having too little data on any one group.","Statistical Modeling-General, Mitigation",FAccT,2018,https://proceedings.mlr.press/v81/dwork18a.html,
Recommendation Independence,"Toshihiro Kamishima, Shotaro Akaho, Hideki Asoh,  Jun Sakuma","This paper studies a recommendation algorithm whose outcomes are not influenced by specified information. It is useful in contexts potentially unfair decision should be avoided, such as job-applicant recommendations that are not influenced by socially sensitive information. An algorithm that could exclude the influence of sensitive information would thus be useful for job-matching with fairness. We call the condition between a recommendation outcome and a sensitive feature Recommendation Independence, which is formally defined as statistical independence between the outcome and the feature. Our previous independence-enhanced algorithms simply matched the means of predictions between sub-datasets consisting of the same sensitive value. However, this approach could not remove the sensitive information represented by the second or higher moments of distributions. In this paper, we develop new methods that can deal with the second moment, i.e., variance, of recommendation outcomes without increasing the computational complexity. These methods can more strictly remove the sensitive information, and experimental results demonstrate that our new algorithms can more effectively eliminate the factors that undermine fairness. Additionally, we explore potential applications for independence-enhanced recommendation, and discuss its relation to other concepts, such as recommendation diversity.","Statistical Modeling-General, Mitigation",FAccT,2018,https://proceedings.mlr.press/v81/kamishima18a.html,
