Paper Title,Authors,Description,Tags/Comments,Conference Venue,Year,Paper link,Additional resources
Automating Procedurally Fair Feature Selection in Machine Learning,"Clara Belitz, Lan Jiang,  Nigel Bosch","In recent years, machine learning has become more common in everyday applications. Consequently, numerous studies have explored issues of unfairness against specific groups or individuals in the context of these applications. Much of the previous work on unfairness in machine learning has focused on the fairness of outcomes rather than process. We propose a feature selection method inspired by fair process (procedural fairness) in addition to fair outcome. Specifically, we introduce the notion of unfairness weight, which indicates how heavily to weight unfairness versus accuracy when measuring the marginal benefit of adding a new feature to a model. Our goal is to maintain accuracy while reducing unfairness, as defined by six common statistical definitions. We show that this approach demonstrably decreases unfairness as the unfairness weight is increased, for most combinations of metrics and classifiers used. A small subset of all the combinations of datasets (4), unfairness metrics (6), and classifiers (3), however, demonstrated relatively low unfairness initially. For these specific combinations, neither unfairness nor accuracy were affected as unfairness weight changed, demonstrating that this method does not reduce accuracy unless there is also an equivalent decrease in unfairness. We also show that this approach selects unfair features and sensitive features for the model less frequently as the unfairness weight increases. As such, this procedure is an effective approach to constructing classifiers that both reduce unfairness and are less likely to include unfair features in the modeling process.","Data Preprocessing-Feature Selection, Problem Identification/Measurement",AIES,2021,https://dl.acm.org/doi/10.1145/3461702.3462585,
Hunting for Discriminatory Proxies in Linear Regression Models,"Samuel Yeom, Anupam Datta,  Matt Fredrikson","A machine learning model may exhibit discrimination when used to make decisions involving people. One potential cause for such outcomes is that the model uses a statistical proxy for a protected demographic attribute. In this paper we formulate a definition of proxy use for the setting of linear regression and present algorithms for detecting proxies. Our definition follows recent work on proxies in classification models, and characterizes a model's constituent behavior that: 1) correlates closely with a protected random variable, and 2) is causally influential in the overall behavior of the model. We show that proxies in linear regression models can be efficiently identified by solving a second-order cone program, and further extend this result to account for situations where the use of a certain input variable is justified as a ``business necessity''. Finally, we present empirical results on two law enforcement datasets that exhibit varying degrees of racial disparity in prediction outcomes, demonstrating that proxies shed useful light on the causes of discriminatory behavior in models.","Data Preprocessing-Feature Selection, Problem Identification/Mitigation",NeurIPS,2018,https://proceedings.neurips.cc/paper/2018/hash/6cd9313ed34ef58bad3fdd504355e72c-Abstract.html,
FlipTest: fairness testing via optimal transport,"Emily Black, Samuel Yeom,  Matt Fredrikson","We present FlipTest, a black-box technique for uncovering discrimination in classifiers. FlipTest is motivated by the intuitive question: had an individual been of a different protected status, would the model have treated them differently? Rather than relying on causal information to answer this question, FlipTest leverages optimal transport to match individuals in different protected groups, creating similar pairs of in-distribution samples. We show how to use these instances to detect discrimination by constructing a flipset: the set of individuals whose classifier output changes post-translation, which corresponds to the set of people who may be harmed because of their group membership. To shed light on why the model treats a given subgroup differently, FlipTest produces a transparency report: a ranking of features that are most associated with the model's behavior on the flipset. Evaluating the approach on three case studies, we show that this provides a computationally inexpensive way to identify subgroups that may be harmed by model discrimination, including in cases where the model satisfies group fairness criteria.","Data Preprocessing-Feature Selection/Testing and Validation-Measurement, Problem Identification",FAccT,2020,https://dl.acm.org/doi/abs/10.1145/3351095.3372845,
Feature-Wise Bias Amplification,"Klas Leino, Matt Fredrikson, Emily Black, Shayak Sen,  Anupam Datta","We study the phenomenon of bias amplification in classifiers, wherein a machine learning model learns to predict classes with a greater disparity than the underlying ground truth. We demonstrate that bias amplification can arise via inductive bias in gradient descent methods resulting in overestimation of importance of moderately-predictive ``weak'' features if insufficient training data is available. This overestimation gives rise to feature-wise bias amplification -- a previously unreported form of bias that can be traced back to the features of a trained model. Through analysis and experiments, we show that the while some bias cannot be mitigated without sacrificing accuracy, feature-wise bias amplification can be mitigated through targeted feature selection. We present two new feature selection algorithms for mitigating bias amplification in linear models, and show how they can be adapted to convolutional neural networks efficiently. Our experiments on synthetic and real data demonstrate that these algorithms consistently lead to reduced bias without harming accuracy, in some cases eliminating predictive bias altogether while providing modest gains in accuracy.","Data Preprocessing-Feature Selection, Problem Identification",ICLR,2019,https://openreview.net/forum?id=S1ecm2C9K7,
Assessing social and intersectional biases in contextualized word representations,"Yi Chern Tan, L. Elisa Celis","Social bias in machine learning has drawn significant attention, with work ranging from demonstrations of bias in a multitude of applications, curating definitions of fairness for different contexts, to developing algorithms to mitigate bias. In natural language processing, gender bias has been shown to exist in context-free word embeddings. Recently, contextual word representations have outperformed word embeddings in several downstream NLP tasks. These word representations are conditioned on their context within a sentence, and can also be used to encode the entire sentence. In this paper, we analyze the extent to which state-of-the-art models for contextual word representations, such as BERT and GPT-2, encode biases with respect to gender, race, and intersectional identities. Towards this, we propose assessing bias at the contextual word level. This novel approach captures the contextual effects of bias missing in context-free word embeddings, yet avoids confounding effects that underestimate bias at the sentence encoding level. We demonstrate evidence of bias at the corpus level, find varying evidence of bias in embedding association tests, show in particular that racial bias is strongly encoded in contextual word models, and observe that bias effects for intersectional minorities are exacerbated beyond their constituent minority identities. Further, evaluating bias effects at the contextual word level captures biases that are not captured at the sentence level, confirming the need for our novel approach.","Data Preprocessing-Feature Selection, Measurement",NeurIPS,2019,https://dl.acm.org/doi/10.5555/3454287.3455472,
Fairness for AUC via Feature Augmentation,"Hortense Fong, Vineet Kumar, Anay Mehrotra,  Nisheeth K. Vishnoi","We study fairness in the context of classification where the performance is measured by the area under the curve (AUC) of the receiver operating characteristic. AUC is commonly used when both Type¬†I (false positive) and Type II (false negative) errors are important. However, the same classifier can have significantly varying AUCs for different protected groups and, in real-world applications, it is often desirable to reduce such cross-group differences. We address the problem of how to select additional features to most greatly improve AUC for the disadvantaged group. Our results establish that the unconditional variance of features does not inform us about AUC fairness but class-conditional variance does. Using this connection, we develop a novel approach, fairAUC, based on feature augmentation (adding features) to mitigate bias between identifiable groups. We evaluate fairAUC on synthetic and real-world (COMPAS) datasets and find that it significantly improves AUC for the disadvantaged group relative to benchmarks maximizing overall AUC and minimizing bias between groups.","Data Preprocessing-Feature Selection, Mitigation",FAccT,2022,https://dl.acm.org/doi/10.1145/3531146.3533126,
A Geometric Solution to Fair Representations,"Yuzi He, Keith Burghardt,  Kristina Lerman","To reduce human error and prejudice, many high-stakes decisions have been turned over to machine algorithms. However, recent research suggests that this does not remove discrimination, and can perpetuate harmful stereotypes. While algorithms have been developed to improve fairness, they typically face at least one of three shortcomings: they are not interpretable, their prediction quality deteriorates quickly compared to unbiased equivalents, and %the methodology cannot easily extend other algorithms they are not easily transferable across models% (e.g., methods to reduce bias in random forests cannot be extended to neural networks) . To address these shortcomings, we propose a geometric method that removes correlations between data and any number of protected variables. Further, we can control the strength of debiasing through an adjustable parameter to address the trade-off between prediction quality and fairness. The resulting features are interpretable and can be used with many popular models, such as linear regression, random forest, and multilayer perceptrons. The resulting predictions are found to be more accurate and fair compared to several state-of-the-art fair AI algorithms across a variety of benchmark datasets. Our work shows that debiasing data is a simple and effective solution toward improving fairness.","Data Preprocessing-Feature Selection, Mitigation (Traditional)",AIES,2020,https://dl.acm.org/doi/10.1145/3375627.3375864,
Controllable invariance through adversarial feature learning,"Qizhe Xie, Zihang Dai, Yulun Du, Eduard Hovy,  Graham Neubig","Learning meaningful representations that maintain the content necessary for a particular task while filtering away detrimental variations is a problem of great interest in machine learning. In this paper, we tackle the problem of learning representations invariant to a specific factor or trait of data. The representation learning process is formulated as an adversarial minimax game. We analyze the optimal equilibrium of such a game and find that it amounts to maximizing the uncertainty of inferring the detrimental factor given the representation while maximizing the certainty of making task-specific predictions. On three benchmark tasks, namely fair and bias-free classification, language-independent generation, and lighting-independent image classification, we show that the proposed framework induces an invariant representation, and leads to better generalization evidenced by the improved performance.","Data Preprocessing-Data Cleaning (Omission), Measurement",NeurIPS,2017,https://dl.acm.org/doi/10.5555/3294771.3294827,
Data Validation for Machine Learning,"Eric Breck, Neoklis Polyzotis, Sudip Roy, Steven Whang,  Martin Zinkevich","Machine learning is a powerful tool for gleaning knowledge from massive amounts of data. While a great deal
of machine learning research has focused on improving the accuracy and efficiency of training and inference
algorithms, there is less attention in the equally important problem of monitoring the quality of data fed to machine
learning. The importance of this problem is hard to dispute: errors in the input data can nullify any benefits
on speed and accuracy for training and inference. This argument points to a data-centric approach to machine
learning that treats training and serving data as an important production asset, on par with the algorithm and
infrastructure used for learning.
In this paper, we tackle this problem and present a data validation system that is designed to detect anomalies
specifically in data fed into machine learning pipelines. This system is deployed in production as an integral
part of TFX(Baylor et al., 2017) – an end-to-end machine learning platform at Google. It is used by hundreds
of product teams use it to continuously monitor and validate several petabytes of production data per day. We
faced several challenges in developing our system, most notably around the ability of ML pipelines to soldier on
in the face of unexpected patterns, schema-free data, or training/serving skew. We discuss these challenges, the
techniques we used to address them, and the various design choices that we made in implementing the system.
Finally, we present evidence from the system’s deployment in production that illustrate the tangible benefits of
data validation in the context of ML: early detection of errors, model-quality wins from using better data, savings
in engineering hours to debug problems, and a shift towards data-centric workflows in model development.","Data Preprocessing-Data Cleaning (Omission), Measurement",MLSys,2019,https://mlsys.org/Conferences/2019/doc/2019/167.pdf,
Optimized Pre-Processing for Discrimination Prevention,"Flavio Calmon, Dennis Wei, Bhanukiran Vinzamuri, Karthikeyan Natesan Ramamurthy,  Kush R Varshney","Non-discrimination is a recognized objective in algorithmic decision making. In this paper, we introduce a novel probabilistic formulation of data pre-processing for reducing discrimination. We propose a convex optimization for learning a data transformation with three goals: controlling discrimination, limiting distortion in individual data samples, and preserving utility. We characterize the impact of limited sample size in accomplishing this objective. Two instances of the proposed optimization are applied to datasets, including one on real-world criminal recidivism. Results show that discrimination can be greatly reduced at a small cost in classification accuracy.","Data Preprocessing-Data Cleaning (Omission), Mitigation",NeurIPS,2017,https://papers.nips.cc/paper_files/paper/2017/hash/9a49a25d845a483fae4be7e341368e36-Abstract.html,
Towards Fair Deep Anomaly Detection,Hongjing Zhang  Ian Davidson,"Anomaly detection aims to find instances that are considered unusual and is a fundamental problem of data science. Recently, deep anomaly detection methods were shown to achieve superior results particularly in complex data such as images. Our work focuses on deep one-class classification for anomaly detection which learns a mapping only from the normal samples. However, the non-linear transformation performed by deep learning can potentially find patterns associated with social bias. The challenge with adding fairness to deep anomaly detection is to ensure both making fair and correct anomaly predictions simultaneously. In this paper, we propose a new architecture for the fair anomaly detection approach (Deep Fair SVDD) and train it using an adversarial network to de-correlate the relationships between the sensitive attributes and the learned representations. This differs from how fairness is typically added namely as a regularizer or a constraint. Further, we propose two effective fairness measures and empirically demonstrate that existing deep anomaly detection methods are unfair. We show that our proposed approach can remove the unfairness largely with minimal loss on the anomaly detection performance. Lastly, we conduct an in-depth analysis to show the strength and limitations of our proposed model, including parameter analysis, feature visualization, and run-time analysis.","Data Preprocessing-Data Cleaning (Omission), Mitigation",FAccT,2021,https://dl.acm.org/doi/10.1145/3442188.3445878,
"The Data Linter: Lightweight, Automated Sanity Checking for ML Data Sets","Nick Hynes, D. Sculley,  Michael Terry","Data cleaning and feature engineering are both common practices when developing machine learning (ML) models. However, developers are not always aware of best practices for preparing or transforming data for a given model type, which can lead to suboptimal representations of input features. To address this issue, we introduce the data linter, a new class of ML tool that automatically inspects ML data sets to 1) identify potential issues in the data and 2) suggest potentially useful feature transforms, for a given model type. As with traditional code linting, data linting automatically identifies potential issues or inefficiencies; codifies best practices and educates end-users about these practices through tool use; and can lead to quality improvements. In this paper, we provide a detailed description of data linting, describe our initial implementation of a data linter for deep neural networks, and report results suggesting the utility of using a data linter during ML model design.","Data Preprocessing-Data Cleaning (Omission), Mitigation",NeurIPS ML Systems workshop,2017,http://learningsys.org/nips17/assets/papers/paper_19.pdf,
ActiveClean: interactive data cleaning for statistical modeling,"Sanjay Krishnan, Jiannan Wang, Eugene Wu, Michael J Franklin,  Ken Goldberg","Analysts often clean dirty data iteratively--cleaning some data, executing the analysis, and then cleaning more data based on the results. We explore the iterative cleaning process in the context of statistical model training, which is an increasingly popular form of data analytics. We propose ActiveClean, which allows for progressive and iterative cleaning in statistical modeling problems while preserving convergence guarantees. ActiveClean supports an important class of models called convex loss models (e.g., linear regression and SVMs), and prioritizes cleaning those records likely to affect the results. We evaluate ActiveClean on five real-world datasets UCI Adult, UCI EEG, MNIST, IMDB, and Dollars For Docs with both real and synthetic errors. The results show that our proposed optimizations can improve model accuracy by up-to 2.5x for the same amount of data cleaned. Furthermore for a fixed cleaning budget and on all real dirty datasets, ActiveClean returns more accurate models than uniform sampling and Active Learning.","Data Preprocessing-Data Cleaning (Omission), Mitigation",VLDB Endowment,2016,https://dl.acm.org/doi/10.14778/2994509.2994514,
"Gender Bias in Word Embeddings: A Comprehensive Analysis of Frequency, Syntax, and Semantics","Aylin Caliskan, Pimparkar Parth Ajay, Tessa Charlesworth, Robert Wolfe,  Mahzarin R. Banaji","Word embeddings are numeric representations of meaning derived from word co-occurrence statistics in corpora of human-produced texts. The statistical regularities in language corpora encode well-known social biases into word embeddings (e.g., the word vector for family is closer to the vector women than to men). Although efforts have been made to mitigate bias in word embeddings, with the hope of improving fairness in downstream Natural Language Processing (NLP) applications, these efforts will remain limited until we more deeply understand the multiple (and often subtle) ways that social biases can be reflected in word embeddings. Here, we focus on gender to provide a comprehensive analysis of group-based biases in widely-used static English word embeddings trained on internet corpora (GloVe 2014, fastText 2017). While some previous research has helped uncover biases in specific semantic associations between a group and a target domain (e.g., women - family), using the Single-Category Word Embedding Association Test, we demonstrate the widespread prevalence of gender biases that also show differences in: (1) frequencies of words associated with men versus women; (b) part-of-speech tags in gender-associated words; (c) semantic categories in gender-associated words; and (d) valence, arousal, and dominance in gender-associated words. We leave the analysis of non-binary gender to future work due to the challenges in accurate group representation caused by limitations inherent in data. First, in terms of word frequency: we find that, of the 1,000 most frequent words in the vocabulary, 77% are more associated with men than women, providing direct evidence of a masculine default in the everyday language of the English-speaking world. Second, turning to parts-of-speech: the top male-associated words are typically verbs (e.g., fight, overpower) while the top female-associated words are typically adjectives and adverbs (e.g., giving, emotionally). Gender biases in embeddings also permeate parts-of-speech. Third, for semantic categories: bottom-up, cluster analyses of the top 1,000 words associated with each gender. The top male-associated concepts include roles and domains of big tech, engineering, religion, sports, and violence; in contrast, the top female-associated concepts are less focused on roles, including, instead, female-specific slurs and sexual content, as well as appearance and kitchen terms. Fourth, using human ratings of word valence, arousal, and dominance from a ~20,000 word lexicon, we find that male-associated words are higher on arousal and dominance, while female-associated words are higher on valence. Ultimately, these findings move the study of gender bias in word embeddings beyond the basic investigation of semantic relationships to also study gender differences in multiple manifestations in text. Given the central role of word embeddings in NLP applications, it is essential to more comprehensively document where biases exist and may remain hidden, allowing them to persist without our awareness throughout large text corpora.","Data Preprocessing-General, Problem Identification",AIES,2022,https://dl.acm.org/doi/abs/10.1145/3514094.3534162,
Does enforcing fairness mitigate biases caused by subpopulation shift?,"Subha Maity, Debarghya Mukherjee, Mikhail Yurochkin,  Yuekai Sun","Many instances of algorithmic bias are caused by subpopulation shifts. For example, ML models often perform worse on demographic groups that are underrepresented in the training data. In this paper, we study whether enforcing algorithmic fairness during training improves the performance of the trained model in the \emph{target domain}. On one hand, we conceive scenarios in which enforcing fairness does not improve performance in the target domain. In fact, it may even harm performance. On the other hand, we derive necessary and sufficient conditions under which enforcing algorithmic fairness leads to the Bayes model in the target domain. We also illustrate the practical implications of our theoretical results in simulations and on real data.","Data Preprocessing-General, Problem Identification",NeurIPS,2021,https://openreview.net/forum?id=6mUrD5rg-UU,
Towards Understanding and Mitigating Social Biases in Language Models,"Paul Pu Liang, Chiyu Wu, Louis-Philippe Morency,  Ruslan Salakhutdinov","As machine learning methods are deployed in real-world settings such as healthcare, legal systems, and social science, it is crucial to recognize how they shape social biases and stereotypes in these sensitive decision-making processes. Among such real-world deployments are large-scale pretrained language models (LMs) that can be potentially dangerous in manifesting undesirable representational biases - harmful biases resulting from stereotyping that propagate negative generalizations involving gender, race, religion, and other social constructs. As a step towards improving the fairness of LMs, we carefully define several sources of representational biases before proposing new benchmarks and metrics to measure them. With these tools, we propose steps towards mitigating social biases during text generation. Our empirical results and human evaluation demonstrate effectiveness in mitigating bias while retaining crucial contextual information for high-fidelity text generation, thereby pushing forward the performance-fairness Pareto frontier.","Data Preprocessing-General, Problem Identification",ICML,2021,https://proceedings.mlr.press/v139/liang21a.html,
