Paper Title,Authors,Description,Tags/Comments,Conference Venue,Year,Paper link,Additional resources
Fairness through computationally-bounded awareness,"Michael Kim, Omer Reingold,  Guy Rothblum","We study the problem of fair classification within the versatile framework of Dwork et al. [ITCS '12], which assumes the existence of a metric that measures similarity between pairs of individuals. Unlike earlier work, we do not assume that the entire metric is known to the learning algorithm; instead, the learner can query this arbitrary metric a bounded number of times. We propose a new notion of fairness called metric multifairness and show how to achieve this notion in our setting. Metric multifairness is parameterized by a similarity metric d on pairs of individuals to classify and a rich collection C of (possibly overlapping) ""comparison sets"" over pairs of individuals. At a high level, metric multifairness guarantees that similar subpopulations are treated similarly, as long as these subpopulations are identified within the class C.","Testing and Validation-Evaluation Metrics, Measurement (Traditional)",NeurIPS,2018,https://dl.acm.org/doi/10.5555/3327345.3327393,
Equality of Opportunity in Classification: A Causal Approach,"Junzhe Zhang, Elias Bareinboim","The Equalized Odds (for short, EO) is one of the most popular measures of discrimination used in the supervised learning setting. It ascertains fairness through the balance of the misclassification rates (false positive and negative) across the protected groups -- e.g., in the context of law enforcement, an African-American defendant who would not commit a future crime will have an equal opportunity of being released, compared to a non-recidivating Caucasian defendant. Despite this noble goal, it has been acknowledged in the literature that statistical tests based on the EO are oblivious to the underlying causal mechanisms that generated the disparity in the first place (Hardt et al. 2016). This leads to a critical disconnect between statistical measures readable from the data and the meaning of discrimination in the legal system, where compelling evidence that the observed disparity is tied to a specific causal process deemed unfair by society is required to characterize discrimination. The goal of this paper is to develop a principled approach to connect the statistical disparities characterized by the EO and the underlying, elusive, and frequently unobserved, causal mechanisms that generated such inequality. We start by introducing a new family of counterfactual measures that allows one to explain the misclassification disparities in terms of the underlying mechanisms in an arbitrary, non-parametric structural causal model. This will, in turn, allow legal and data analysts to interpret currently deployed classifiers through causal lens, linking the statistical disparities found in the data to the corresponding causal processes. Leveraging the new family of counterfactual measures, we develop a learning procedure to construct a classifier that is statistically efficient, interpretable, and compatible with the basic human intuition of fairness. We demonstrate our results through experiments in both real (COMPAS) and synthetic datasets.","Testing and Validation-Evaluation Metrics, Measurement (Traditional)",NeurIPS,2018,https://papers.nips.cc/paper_files/paper/2018/hash/ff1418e8cc993fe8abcfe3ce2003e5c5-Abstract.html,
The fairness of risk scores beyond classification: bipartite ranking and the xAUC metric,"Nathan Kallus, Angela Zhou","Where machine-learned predictive risk scores inform high-stakes decisions, such as bail and sentencing in criminal justice, fairness has been a serious concern. Recent work has characterized the disparate impact that such risk scores can have when used for a binary classification task. This may not account, however, for the more diverse downstream uses of risk scores and their non-binary nature. To better account for this, in this paper, we investigate the fairness of predictive risk scores from the point of view of a bipartite ranking task, where one seeks to rank positive examples higher than negative ones. We introduce the xAUC disparity as a metric to assess the disparate impact of risk scores and define it as the difference in the probabilities of ranking a random positive example from one protected group above a negative one from another group and vice versa. We provide a decomposition of bipartite ranking loss into components that involve the discrepancy and components that involve pure predictive ability within each group. We use xAUC analysis to audit predictive risk scores for recidivism prediction, income prediction, and cardiac arrest prediction, where it describes disparities that are not evident from simply comparing within-group predictive performance.","Testing and Validation-Evaluation Metrics, Measurement (Traditional)",NeurIPS,2019,https://dl.acm.org/doi/10.5555/3454287.3454596,
Model class reliance for random forests,"Gavin Smith, Roberto Mansilla,  James Goulding","Variable Importance (VI) has traditionally been cast as the process of estimating each variables contribution to a predictive model's overall performance. Analysis of a single model instance, however, guarantees no insight into a variables relevance to underlying generative processes. Recent research has sought to address this concern via analysis of Rashomon sets - sets of alternative model instances that exhibit equivalent predictive performance to some reference model, but which take different functional forms. Measures such as Model Class Reliance (MCR) have been proposed, that are computed against Rashomon sets, in order to ascertain how much a variable must be relied on to make robust predictions, or whether alternatives exist. If MCR range is tight, we have no choice but to use a variable; if range is high then there exists competing, perhaps fairer models, that provide alternative explanations of the phenomena being examined. Applications are wide, from enabling construction of `fairer' models in areas such as recidivism, health analytics and ethical marketing. Tractable estimation of MCR for non-linear models is currently restricted to Kernel Regression under squared loss \cite{fisher2019all}. In this paper we introduce a new technique that extends computation of Model Class Reliance (MCR) to Random Forest classifiers and regressors. The proposed approach addresses a number of open research questions, and in contrast to prior Kernel SVM MCR estimation, runs in linearithmic rather than polynomial time. Taking a fundamentally different approach to previous work, we provide a solution for this important model class, identifying situations where irrelevant covariates do not improve predictions.","Testing and Validation-Evaluation Metrics, Measurement (Traditional)",NeurIPS,2020,https://dl.acm.org/doi/10.5555/3495724.3497594,
Statistical inference for individual fairness,"Subha Maity, Songkai Xue, Mikhail Yurochkin,  Yuekai Sun","As we rely on machine learning (ML) models to make more consequential decisions, the issue of ML models perpetuating unwanted social biases has come to the fore of the public's and the research community's attention. In this paper, we focus on the problem of detecting violations of individual fairness in ML models. We formalize the problem as measuring the susceptibility of ML models against a form of adversarial attack and develop a suite of inference tools for the adversarial loss. The tools allow practitioners to assess the individual fairness of ML models in a statistically-principled way: form confidence intervals for the adversarial loss and test hypotheses of model fairness with (asymptotic) non-coverage/Type I error rate control. We demonstrate the utility of our tools in a real-world case study.","Testing and Validation-Evaluation Metrics, Measurement (Traditional)",ICLR,2021,https://openreview.net/forum?id=z9k8BWL-%5F2u,
Generalized Demographic Parity for Group Fairness,"Zhimeng Jiang, Xiaotian Han, Chao Fan, Fan Yang, Ali Mostafavi,  Xia Hu","This work aims to generalize demographic parity to continuous sensitive attributes while preserving tractable computation. Current fairness metrics for continuous sensitive attributes largely rely on intractable statistical independence between variables, such as Hirschfeld-Gebelein-Renyi (HGR) and mutual information. Statistical fairness metrics estimation relying on either tractable bounds or neural network approximation, however, are not sufficiently trustful to rank algorithms prediction bias due to lack of estimation accuracy guarantee. 
To make fairness metrics trustable, we propose \textit{\underline{G}eneralized \underline{D}emographic \underline{P}arity} (GDP), a group fairness metric for continuous and discrete attributes. We show the understanding of GDP from the probability perspective and theoretically reveal the connection between GDP regularizer and adversarial debiasing. To estimate GDP, we adopt hard and soft group strategies via the one-hot or the soft group indicator, representing the membership of each sample in different groups of the sensitive attribute. We provably and numerically show that the soft group strategy achieves a faster estimation error convergence rate. Experiments show the better bias mitigation performance of GDP regularizer, compared with adversarial debiasing, for regression and classification tasks in tabular and graph benchmarks.","Testing and Validation-Evaluation Metrics, Measurement (Traditional)",ICLR,2022,https://openreview.net/forum?id=YigKlMJwjye,
Measuring Fairness in an Unfair World,Jonathan Herington,"Computer scientists have made great strides in characterizing different measures of algorithmic fairness, and showing that certain measures of fairness cannot be jointly satisfied. In this paper, I argue that the three most popular families of measures - unconditional independence, target-conditional independence and classification-conditional independence - make assumptions that are unsustainable in the context of an unjust world. I begin by introducing the measures and the implicit idealizations they make about the underlying causal structure of the contexts in which they are deployed. I then discuss how these idealizations fall apart in the context of historical injustice, ongoing unmodeled oppression, and the permissibility of using sensitive attributes to rectify injustice. In the final section, I suggest an alternative framework for measuring fairness in the context of existing injustice: distributive fairness.","Testing and Validation-Evaluation Metrics, Measurement (Traditional)",AIES,2020,https://dl.acm.org/doi/10.1145/3375627.3375854,
An Axiomatic Theory of Provably-Fair Welfare-Centric Machine Learning,Cyrus Cousins,"We address an inherent difficulty in welfare-theoretic fair machine learning (ML), by proposing an equivalently-axiomatically justified alternative setting, and studying the resulting computational and statistical learning questions. Welfare metrics quantify overall wellbeing across a population of groups, and welfare-based objectives and constraints have recently been proposed to incentivize fair ML methods to satisfy their diverse needs. However, many ML problems are cast as loss minimization tasks, rather than utility maximization, and thus require nontrivial modeling to construct utility functions. We define a complementary metric, termed malfare, measuring overall societal harm, with axiomatic justification via the standard axioms of cardinal welfare, and cast fair ML as malfare minimization over the risk values (expected losses) of each group. Surprisingly, the axioms of cardinal welfare (malfare) dictate that this is not equivalent to simply defining utility as negative loss and maximizing welfare. Building upon these concepts, we define fair-PAC learning, where a fair-PAC learner is an algorithm that learns an Œµ-Œ¥ malfare-optimal model with bounded sample complexity, for any data distribution and (axiomatically justified) malfare concept. Finally, we show conditions under which many standard PAC-learners may be converted to fair-PAC learners, which places fair-PAC learning on firm theoretical ground, as it yields statistical ‚Äî and in some cases computational ‚Äî efficiency guarantees for many well-studied ML models. Fair-PAC learning is also practically relevant, as it democratizes fair ML by providing concrete training algorithms with rigorous generalization guarantees.","Testing and Validation-Evaluation Metrics, Measurement (Traditional)",NeurIPS,2021,https://proceedings.neurips.cc/paper/2021/hash/8b0bb3eff8c1e5bf7f206125959921d7-Abstract.html,
"Counterfactual risk assessments, evaluation, and fairness","Ama Coston, Alan Mishler, Edward H. Kennedy,  Alexra Chouldechova","Algorithmic risk assessments are increasingly used to help humans make decisions in high-stakes settings, such as medicine, criminal justice and education. In each of these cases, the purpose of the risk assessment tool is to inform actions, such as medical treatments or release conditions, often with the aim of reducing the likelihood of an adverse event such as hospital readmission or recidivism. Problematically, most tools are trained and evaluated on historical data in which the outcomes observed depend on the historical decision-making policy. These tools thus reflect risk under the historical policy, rather than under the different decision options that the tool is intended to inform. Even when tools are constructed to predict risk under a specific decision, they are often improperly evaluated as predictors of the target outcome. Focusing on the evaluation task, in this paper we define counterfactual analogues of common predictive performance and algorithmic fairness metrics that we argue are better suited for the decision-making context. We introduce a new method for estimating the proposed metrics using doubly robust estimation. We provide theoretical results that show that only under strong conditions can fairness according to the standard metric and the counterfactual metric simultaneously hold. Consequently, fairness-promoting methods that target parity in a standard fairness metric may---and as we show empirically, do---induce greater imbalance in the counterfactual analogue. We provide empirical comparisons on both synthetic data and a real world child welfare dataset to demonstrate how the proposed method improves upon standard practice.","Testing and Validation-Evaluation Metrics, Measurement (Traditional)",FAccT,2020,https://dl.acm.org/doi/10.1145/3351095.3372851,
Counterfactual Fairness in Text Classification through Robustness,"Sahaj Garg, Vincent Perot, Nicole Limtiaco, Ankur Taly, Ed H. Chi,  Alex Beutel","In this paper, we study counterfactual fairness in text classification, which asks the question: How would the prediction change if the sensitive attribute referenced in the example were different? Toxicity classifiers demonstrate a counterfactual fairness issue by predicting that ""Some people are gay"" is toxic while ""Some people are straight"" is nontoxic. We offer a metric, counterfactual token fairness (CTF), for measuring this particular form of fairness in text classifiers, and describe its relationship with group fairness. Further, we offer three approaches, blindness, counterfactual augmentation, and counterfactual logit pairing (CLP), for optimizing counterfactual token fairness during training, bridging the robustness and fairness literature. Empirically, we find that blindness and CLP address counterfactual token fairness. The methods do not harm classifier performance, and have varying tradeoffs with group fairness. These approaches, both for measurement and optimization, provide a new path forward for addressing fairness concerns in text classification.","Testing and Validation-Evaluation Metrics, Measurement (Traditional)",AIES,2019,https://dl.acm.org/doi/10.1145/3306618.3317950,
Contrastive Counterfactual Fairness in Algorithmic Decision-Making,"Ece Çiğdem Mutlu, Niloofar Yousefi,  Ozlem Ozmen Garibay","The widespread use of artificial intelligence algorithms and their role in decision-making with consequential decisions for human subjects has resulted in a growing interest in designing AI algorithms accounting for fairness considerations. There have been attempts to account for fairness of AI algorithms without compromising their accuracy to improve poorly designed algorithms that disregard sensitive attributes (e.g., age, race, and gender) at the peril of introducing or increasing bias against specific groups. Although many studies have examined the optimal trade-off between fairness and accuracy, it remains a challenge to understand the sources of unfairness in decision-making and mitigate it effectively. To tackle this problem, researchers have proposed fair causal learning approaches which assist us in modeling cause and effect knowledge structures, discovering bias sources, and refining AI algorithms to make them more transparent and explainable. In this study, we formalize probabilistic interpretations of both contrastive and counterfactual causality as essential features in order to encourage users' trust and to expand the applicability of such automated systems. We use this formalism to define a novel fairness criterion that we call contrastive counterfactual fairness. This paper introduces, to the best of our knowledge, the first probabilistic fairness-aware data augmentation approach that is based on contrastive counterfactual causality. We tested our approach on two well-known fairness-related datasets, UCI Adult and German Credit, and concluded that our proposed method has a promising ability to capture and mitigate unfairness in AI deployment. This model-agnostic approach can be used with any AI model because it is applied in pre-processing.","Testing and Validation-Evaluation Metrics, Measurement (Traditional)",AIES,2022,https://dl.acm.org/doi/10.1145/3514094.3534143,
Evaluating Fairness of Machine Learning Models Under Uncertain and Incomplete Information,"Pranjal Awasthi, Alex Beutel, Matthäus Kleindessner, Jamie Morgenstern,  Xuezhi Wang","Training and evaluation of fair classifiers is a challenging problem. This is partly due to the fact that most fairness metrics of interest depend on both the sensitive attribute information and label information of the data points. In many scenarios it is not possible to collect large datasets with such information. An alternate approach that is commonly used is to separately train an attribute classifier on data with sensitive attribute information, and then use it later in the ML pipeline to evaluate the bias of a given classifier. While such decoupling helps alleviate the problem of demographic scarcity, it raises several natural questions such as: how should the attribute classifier be trained?, and how should one use a given attribute classifier for accurate bias estimation? In this work we study this question from both theoretical and empirical perspectives. We first experimentally demonstrate that the test accuracy of the attribute classifier is not always correlated with its effectiveness in bias estimation for a downstream model. In order to further investigate this phenomenon, we analyze an idealized theoretical model and characterize the structure of the optimal classifier. Our analysis has surprising and counter-intuitive implications where in certain regimes one might want to distribute the error of the attribute classifier as unevenly as possible among the different subgroups. Based on our analysis we develop heuristics for both training and using attribute classifiers for bias estimation in the data scarce regime. We empirically demonstrate the effectiveness of our approach on real and simulated data.","Testing and Validation-Evaluation Metrics, Measurement",FAccT,2021,https://dl.acm.org/doi/10.1145/3442188.3445884,
A Statistical Test for Probabilistic Fairness,"Bahar Taskesen, Jose Blanchet, Daniel Kuhn,  Viet Anh Nguyen","Algorithms are now routinely used to make consequential decisions that affect human lives. Examples include college admissions, medical interventions or law enforcement. While algorithms empower us to harness all information hidden in vast amounts of data, they may inadvertently amplify existing biases in the available datasets. This concern has sparked increasing interest in fair machine learning, which aims to quantify and mitigate algorithmic discrimination. Indeed, machine learning models should undergo intensive tests to detect algorithmic biases before being deployed at scale. In this paper, we use ideas from the theory of optimal transport to propose a statistical hypothesis test for detecting unfair classifiers. Leveraging the geometry of the feature space, the test statistic quantifies the distance of the empirical distribution supported on the test samples to the manifold of distributions that render a pre-trained classifier fair. We develop a rigorous hypothesis testing mechanism for assessing the probabilistic fairness of any pre-trained logistic classifier, and we show both theoretically as well as empirically that the proposed test is asymptotically correct. In addition, the proposed framework offers interpretability by identifying the most favorable perturbation of the data so that the given classifier becomes fair.","Testing and Validation-Evaluation Metrics, Measurement",FAccT,2021,https://dl.acm.org/doi/10.1145/3442188.3445927,
An Outcome Test of Discrimination for Ranked Lists,"Jonathan Roth, Guillaume Saint-Jacques,  YinYin Yu","This paper extends Becker [3]‚Äôs outcome test of discrimination to settings where a (human or algorithmic) decision-maker produces a ranked list of candidates. Ranked lists are particularly relevant in the context of online platforms that produce search results or feeds, and also arise when human decisionmakers express ordinal preferences over a list of candidates. We show that non-discrimination implies a system of moment inequalities, which intuitively impose that one cannot permute the position of a lower-ranked candidate from one group with a higher-ranked candidate from a second group and systematically improve the objective. Moreover, we show that that these moment inequalities are the only testable implications of non-discrimination when the auditor observes only outcomes and group membership by rank. We show how to statistically test the implied inequalities, and validate our approach in an application using data from LinkedIn.1","Testing and Validation-Evaluation Metrics, Measurement",FAccT,2022,https://dl.acm.org/doi/10.1145/3531146.3533102,
Active fairness auditing,"Tom Yan, Chicheng Zhang","The fast spreading adoption of machine learning (ML) by companies across industries poses significant regulatory challenges. One such challenge is scalability: how can regulatory bodies efficiently audit these ML models, ensuring that they are fair? In this paper, we initiate the study of query-based auditing algorithms that can estimate the demographic parity of ML models in a query-efficient manner. We propose an optimal deterministic algorithm, as well as a practical randomized, oracle-efficient algorithm with comparable guarantees. Furthermore, we make inroads into understanding the optimal query complexity of randomized active fairness estimation algorithms. Our first exploration of active fairness estimation aims to put AI governance on firmer theoretical foundations.","Testing and Validation-Evaluation Metrics, Measurement",ICML,2022,https://proceedings.mlr.press/v162/yan22c.html,
Invariant Representations without Adversarial Training,"Daniel Moyer, Shuyang Gao, Rob Brekelmans, Aram Galstyan,  Greg Ver Steeg","Representations of data that are invariant to changes in specified factors are useful for a wide range of problems: removing potential biases in prediction problems, controlling the effects of covariates, and disentangling meaningful factors of variation. Unfortunately, learning representations that exhibit invariance to arbitrary nuisance factors yet remain useful for other tasks is challenging. Existing approaches cast the trade-off between task performance and invariance in an adversarial way, using an iterative minimax optimization. We show that adversarial training is unnecessary and sometimes counter-productive; we instead cast invariant representation learning as a single information-theoretic objective that can be directly optimized. We demonstrate that this approach matches or exceeds performance of state-of-the-art adversarial approaches for learning fair representations and for generative modeling with controllable transformations.","Testing and Validation-Evaluation Metrics, Mitigation",NeurIPS,2018,https://papers.nips.cc/paper_files/paper/2018/hash/415185ea244ea2b2bedeb0449b926802-Abstract.html,
